{
  "schema_version": "1.0",
  "task_id": "frontend-charting-research",
  "description": "Research React charting library options to resolve the deferred frontend charting strategy decision for the NBA visualizer platform",
  "current_phase": "4-review",
  "auto_commit": false,
  "phases": {
    "1-research": {
      "status": "completed",
      "started_at": "2026-05-08",
      "ready_at": "2026-05-08",
      "completed_at": "2026-05-09",
      "approved_at": "2026-05-09",
      "approved_by": "user",
      "output_file": ".agents/tasks/frontend-charting-research/1-research/findings.md"
    },
    "2-plan": {
      "status": "completed",
      "started_at": "2026-05-09",
      "ready_at": "2026-05-09",
      "completed_at": "2026-05-09",
      "approved_at": "2026-05-09",
      "approved_by": "user",
      "output_file": ".agents/tasks/frontend-charting-research/2-plan/plan.md"
    },
    "3-implement": {
      "status": "completed",
      "started_at": "2026-05-09",
      "ready_at": "2026-05-09",
      "completed_at": "2026-05-09",
      "approved_at": "2026-05-09",
      "approved_by": "user",
      "output_file": ".agents/tasks/frontend-charting-research/3-implement/tasks.md"
    },
    "4-review": {
      "status": "completed",
      "started_at": "2026-05-09",
      "ready_at": "2026-05-09",
      "completed_at": "2026-05-09",
      "approved_at": "2026-05-09",
      "approved_by": "user",
      "output_file": ".agents/tasks/frontend-charting-research/4-review/review.md"
    }
  },
  "approval_history": [
    {
      "action": "advance",
      "phase": "1-research",
      "approved_at": "2026-05-09",
      "approved_by": "user",
      "notes": "User approved advancing from 1-research to 2-plan"
    },
    {
      "action": "advance",
      "phase": "2-plan",
      "approved_at": "2026-05-09",
      "approved_by": "user",
      "notes": "User approved advancing from 2-plan to 3-implement"
    },
    {
      "action": "advance",
      "phase": "3-implement",
      "approved_at": "2026-05-09",
      "approved_by": "user",
      "notes": "User approved advancing from 3-implement to 4-review"
    },
    {
      "action": "complete",
      "phase": "4-review",
      "approved_at": "2026-05-09",
      "approved_by": "user",
      "notes": "User approved marking pipeline complete"
    }
  ]
}
