{
  "schema_version": "1.0",
  "task_id": "initial-architecture",
  "description": "Initial NBA data inventory, GitHub research, and architecture recommendations for the NBA visualizer platform",
  "current_phase": "2-plan",
  "auto_commit": false,
  "phases": {
    "1-research": {
      "status": "completed",
      "started_at": "2026-05-08",
      "ready_at": "2026-05-08",
      "completed_at": "2026-05-08",
      "approved_at": "2026-05-08",
      "approved_by": "user",
      "output_file": ".agents/tasks/initial-architecture/1-research/findings.md"
    },
    "2-plan": {
      "status": "in_progress",
      "started_at": "2026-05-08"
    },
    "3-implement": {
      "status": "pending"
    },
    "4-review": {
      "status": "pending"
    }
  },
  "approval_history": [
    {
      "action": "advance",
      "phase": "1-research",
      "approved_at": "2026-05-08",
      "approved_by": "user",
      "notes": "User approved advancing from 1-research to 2-plan"
    }
  ]
}
