{
  "schema_version": "1.0",
  "task_id": "raw-manifest-completeness",
  "description": "Ensure every file under /raw is explicitly accounted for by the manifest and raw manifest verifier",
  "current_phase": "4-review",
  "auto_commit": false,
  "phases": {
    "1-research": {
      "status": "completed",
      "started_at": "2026-05-08",
      "ready_at": "2026-05-08",
      "completed_at": "2026-05-08",
      "approved_at": "2026-05-08",
      "approved_by": "user",
      "output_file": ".agents/tasks/raw-manifest-completeness/1-research/findings.md"
    },
    "2-plan": {
      "status": "completed",
      "started_at": "2026-05-08",
      "ready_at": "2026-05-08",
      "completed_at": "2026-05-08",
      "approved_at": "2026-05-08",
      "approved_by": "user",
      "output_file": ".agents/tasks/raw-manifest-completeness/2-plan/plan.md"
    },
    "3-implement": {
      "status": "completed",
      "started_at": "2026-05-08",
      "ready_at": "2026-05-08",
      "completed_at": "2026-05-08",
      "approved_at": "2026-05-08",
      "approved_by": "user",
      "output_file": ".agents/tasks/raw-manifest-completeness/3-implement/tasks.md"
    },
    "4-review": {
      "status": "completed",
      "started_at": "2026-05-08",
      "ready_at": "2026-05-08",
      "completed_at": "2026-05-08",
      "approved_at": "2026-05-08",
      "approved_by": "user",
      "output_file": ".agents/tasks/raw-manifest-completeness/4-review/review.md"
    }
  },
  "approval_history": [
    {
      "phase": "1-research",
      "approved_at": "2026-05-08",
      "approved_by": "user",
      "action": "advance",
      "notes": "User requested that all raw files be accounted for."
    },
    {
      "phase": "2-plan",
      "approved_at": "2026-05-08",
      "approved_by": "user",
      "action": "advance",
      "notes": "User requested that all raw files be accounted for."
    },
    {
      "phase": "3-implement",
      "approved_at": "2026-05-08",
      "approved_by": "user",
      "action": "advance",
      "notes": "User requested that all raw files be accounted for."
    },
    {
      "phase": "4-review",
      "approved_at": "2026-05-08",
      "approved_by": "user",
      "action": "complete",
      "notes": "Raw manifest completeness validation completed."
    }
  ]
}
